Key_stages,Model_step,Criterion,Author_reference,Issue(Araujo)/Hazard(Soley),Assumption_Description,Assumption_relative_importance,Violation_of_Assumptions,Effects_Category,Effects_Subcategory,Omission_errors,Commission_errors,Potential_Solutions,Explanation (Hypothesis testing),Predictions (Spatially explicit),Projection (Extrapolation),Predictions (Non-spatially explicit),Questions_Evaluation_Tool,Questions_General
Model building,Model settings/complexity,Correlative relationships (species-enviromnment) discovered are stationary over space,,,"""Broad-scale ecological research on species distributions commonly presumes that the correlative relationships discovered are stationary over space"" (Pease et al. 2022).",Modulating assumptions (Low),"""..as the spatial extent of a modeling increases, the likelihood of heterogeneity in the response and the resulting species–environment relationships varying across space also increases. That is, a fixed set of regression coefficients estimated in a species distribution model (SDM) may not represent the actual space-varying relationships between a response (e.g. animal abundance or occupancy) and environmental covariates (e.g. forest cover) (Figure 1). This is termed “nonstationarity” and describes variation in the magnitude and/or direction of a correlative relationship across space or time (Rollinson et al., 2021)"" (Pease et al. 2022).",Accuracy,"Commission errors, Omission errors, Inability to capture the true mechanisms driving species distributions, The relationship between a species and its environment might not be consistent across space (ecological non-stationarity), Redue model transferability",Moderate,Moderate,"Geographically Weighted Regression (GWR) Models., Spatiotemporal variability in the R package sdmTMB (Ward et al. 2022)., Acknowledge modelers were unable to address this assumption.",1,1,1,0,,"""How reliable are future species distribution projections if the underlying relationships between species and their environment (ecological niches) are assumed to be static (stationary) but are, in fact, changing over time or space due to climate change or other factors?"", ""To what extent does violating the non-stationarity assumption introduce bias and uncertainty into model outputs, and for which species or situations is this bias most significant?"", ""What are the most effective methods (e.g. breakpoint analysis, moving window analysis, statistical tests for stationarity) for identifying the presence and nature of non-stationarity in ecological data?"", How can models be formulated to incorporate non-stationarity?, ""Should researchers use local approaches where model coefficients vary across space, or use dynamic/process-based models that explicitly account for changing processes over time?"", How does the choice of predictor variables affect the detection and impact of non-stationarity?, ""At what spatial and temporal scales is the stationarity assumption a valid approximation, and at what scales does it become problematic for different research questions (e.g. short-term, local studies vs. long-term, broad-scale climate change impacts)?"""
Model building,Model estimates,Appropriateness of performance metrics,,,Model performance metrics are appropriate for model assessment.,Working assumptions (Moderate),"Computing AUC and TSS statistics requires the use of true absences (Guillaumot et al. 2019). When the potential distribution is the goal of the research, the AUC is not an appropriate performance measure because the weight of commission errors is much lower than that of omission errors. (Jiménez-Valverde 2011)",Accuracy,"Inadequate model selection, Reduced model transferability",High,High,"""Selecting the Right Metrics: Different metrics (AUC, TSS, Kappa, Tjur's R2), etc.) evaluate different aspects of model performance (e.g. discrimination, calibration, accuracy) and respond differently to factors like species prevalence."", ""Consider Ecological Plausibility: Do not just focus on a high performance score; ensure that the model's relationships with environmental variables are ecologically relevant and make sense based on existing knowledge of the species (e.g. expected temperature responses)."", Acknowledge modelers were unable to address this assumption.",1,1,1,0,"How concerned are you about the adequacy or appropriateness of the validation metrics?, What are the metrics that should be used and why?",
Model building,Model settings/complexity,Appropriateness of background points (pseduo-absences),,,Models are not sensitive to different background point selection strategies (e.g. Steen et al. 2024).,Working assumptions (Moderate),"Selecting random points when there is high sampling bias results in a model assuming that areas beyond the areas sampled heavily are in fact absence locations which is often untrue, and your resulting model will predict your species occurs in areas you sampled but will often miss areas where the species occurs but were not sampled adequately. ","Accuracy, Overpredictions, Undepredictions","Commission errors, Omission errors, Reduced model transferability, Biased Parameter Estimates, Misidentification of key environmental drivers",High,High,"Assess predcitive performance; using  different types of background selections (Steen et al. 2024)., Acknowledge modelers were unable to address this assumption.",1,1,1,1,,
Model building,Model settings/complexity,Relying on default settings,Soley-Guardia et al. (2024),Hazard 4,"Models are fairly insensitive to settings that affect their complexity; or default settings result in an acceptable parameterization regardless of biases and nuances of each input dataset.... This is especially problematic when the occurrence data are biased ..."" (Soley-Guardia et al. 2024). See also, Hallgren et al. 2019, ). ",Working assumptions (Moderate),The configuration settings in SDMs is not standard and alternative to default values must be pursue.,"Accuracy, Precision, Overpredictions, Undepredictions","Commission errors, Omission errors, Potentially misrepresenting species distributions, Potentially misrepresenting suitable habitats, Underprediciton of potential regions of suitability, Reduced model transferability",Moderate,Moderate,"Assess multiple parameterization scenarios (Soley et al. 2024; Valavi et al. 2021)., Document and explain model settings (Hallgren et al. 2019)., Acknowledge modelers were unable to address this assumption.",1,1,1,0,,
Model building,Reducing predictors,Reducing predictor variables irrespective of their information content,Soley-Guardia et al. (2024),Hazard 5,"""Modeling with fewer or less correlated variables yields simpler and better models (Breiman 2001, Elith et al. 2008, Evans et al. 2013) that are not fitted to nuances in the data"" (Soley-Guardia et al. (2024)",Working assumptions (Moderate),"There is a potential situation where two or more predictor variables in a statistical model are linearly related. However, removing predictor variables a priori without consideration of their information content may arbitrarily discard informative data (reducing the predictive ability of the model) and does not directly address the problem of overfitting (Breiman 2001, Olden et al. 2008, Braunisch et al. 2013) (Soley-Guardia et al. 2024).","Accuracy, Overpredictions, Undepredictions","Commission errors, Omission errors, Potentially misrepresenting species distributions, Reduce the statistical power, It inflates the variance of regression parameters, Reduced model transferability, Misidentification of key environmental drivers",High,High,"Assess spatial autocorrelation in model residuals., Use spatial autoregressive models., Use spatial eigenvector mapping., Remove collinear variables to reduce redundancy., Reduce dimenssiionality (Zhang et al. 2023)., Orthogonal Principal Componenents (Farrel et al. 2019)., Algorithms might account for redundant variables (e.g.; Feng et al. 2019)., Select environmental variables for groups of species with similar natural histories (Soley et al. 2024) ., Variable selection approach (Cobos et al. 2019)., Acknowledge modelers were unable to address this assumption.",1,1,1,0,"Which predictors should be removed and why?, Which predictors would you expect to be more or less important and why?",
Model building,Model settings/complexity,Using an overly large study region,Soley-Guardia et al. (2024),Hazard 6,"""Within the study region for model training, the species occurs in spatial equilibrium (i.e., the species inhabits all suitable areas) or environmental equilibrium (i.e., although the species does not occur in all suitable areas, it inhabits an environmentally representative (unbiased) subset of them)"".  A""n appropriate study region approximating the assumption of spatial equilibrium (or the noise assumptions) should be defined using available information regarding the species' natural history and the configuration of the landscape"". (Soley et al. 2024)",Working assumptions (Moderate),"Often, researchers use an overly large study region for model building and/or evaluation (Araújo and Peterson 2012, Liang et al. 2018). Sometimes such a region is selected with the misconception that it will yield an accurate depiction of the species' range (rather than the areas suitable for it) but probably most often because a map of suitability is desired in that full area. (Soley et al. 2024).","Overpredictions, Accuracy","Commission errors, Potentially misrepresenting species distributions",Moderate,High,"""Avoid artificial boundaries and utilize ecological classifications (e.g. ecoregions, biomes, etc.)."", Use Spatially Nested SDMs (N-SDMs)., Acknowledge modelers were unable to address this assumption.",1,1,1,,,"What is the trade-off between resolution and extent?, ""Does a limited extent (e.g. a single island or mountain range) inadvertently truncate the range of environmental conditions the species can tolerate across its full distribution, leading to an incomplete or biased characterization of its niche?"", ""Does increasing the extent to the entire geographic range provide a more complete picture of the species' environmental tolerances, potentially improving model accuracy by encompassing a wider range of environmental conditions?"", ""Alternatively, can too large an extent introduce populations with different environmental responses (due to local adaptation or genetic variation), thereby reducing model accuracy or leading to over-generalized predictions?"", ""Will a model built on a limited extent (e.g. current conditions) accurately predict potential range shifts or expansions into novel environmental conditions (e.g. under climate change scenarios) where environmental data were not available during model training?"", ""Does the choice of extent affect the ability to project models to different geographic areas (e.g. predicting an invasive species' potential range in a new region using data only from its native range)?"", ""Is the chosen extent ecologically relevant to the species' life history, dispersal ability, and habitat selection processes (e.g. home range vs. geographic range)?"", ""How do different extents and grain sizes affect conclusions made about landscape properties, such as habitat connectivity or the impacts of disturbances like roads?"", ""Should models be built at a mosaic of extents to account for non-stationarity in species-environment relationships across a broad area, rather than a single, range-wide model?"", How does niche truncation bias predictions?, When is niche truncation a problem?, How does the shape of the truncated response curve influence outcomes?"
Model assessment,Interpretation,Misinterpreting metrics of model performance,Soley-Guardia et al. (2024),Hazard 7,"Error rates for omission (false negatives) and commission (false positives) are both accurately calculated. For commission error and metrics that include it, comparisons across species or regions assume that the ratio of suitable to unsuitable environments remains constant (Soley-Guardia et al. 2024).",Working assumptions (Moderate),"Sampling bias and lack of data affect model performance. Critically, it follows that because of this bias, such metrics do not represent values of absolute performance, but instead relative ones valid for comparisons only with other analyses for the same species and study region (Soley-Guardia et a. 2024).",Accuracy,It limits the identification of optimal threshold for converting predcitions to binary output,Moderate,High,"Implement null models (Bohl et al. 2019)., Validation omission rate (Soley et al 2024)., Acknowledge modelers were unable to address this assumption.",1,1,1,0,,
Model assessment,Validation,Model training and validation datasets and approaches are appropiate,Soley-Guardia et al. (2024),Hazard 8,"Training and validation datasets created using random splits are independent from one another (Soleye t al. 2024). The method used for valiadation is the most appropiate for evaluating model reliability (e.g. resubtitution, data-splitting, independant data (e.g. Araujo et al. 2005, Hintze et al. 2021, Finn et al. 2024)",Working assumptions (Moderate),Predicitve accuracy of SDMs can only be fully tested by means of validation studies using direct comparison of model predictions with independent. (Araujo et al. 2005). Training and validation datasets created using random splits are independent from one another (Soley-Guardia et al. 2024).,Accuracy,Undesired fitting to biases in the training data which is more likely in overly complex models- will go undetected – yielding inflated measures of performance,High,High,"Splitting data non-randomly  (Soley et al. 2024)., Acknowledge modelers were unable to address this assumption.",1,1,1,1,,
Model assessment,Extrapolation,Misunderstanding or overlooking the effects of extrapolation,Soley-Guardia et al. (2024),Hazard 9,The modeled response to a given variable continues its trend unconstrained.  It is assumed that the response remains fixed at the last value of the training dataset Soley-Guardia et al. 2024). ,Working assumptions (Moderate),The new conditions typically contain at least some non-analog environments (beyond those found in the training study region). This makes extrapolation of the modeled response curves necessary to make a prediction (Soley-Guardia et al. 2024).,Accuracy,Reduced model transferability,High,Very high,"Assessing suitability curves (Owen et al. 2013)., Identify areas of extrict extrapolation; using index such as MESS and MOP (See Owen et al. 2013)., Flagging areas with high uncertainty due to extrapolation (Soley et al. 2024)., Assess model's robustness to extrapolation (e.g.; Roberts et al. 2016)., Acknowledge modelers were unable to address this assumption.",0,0,1,1,,
Model assessment,Transferability,Model transferability,,,Models are able to accurately predict species responses under novel conditions. (See Charney et al. 2021).,Fundamental assumptions (High),There will be novel conditions in some geographic areas under climate change scenarios that are not considered.,"Accuracy, Overpredictions",The relationship between a species and its environment might not be consistent across space (ecological non-stationarity),Very high,Very high,Acknowledge modelers were unable to address this assumption.,0,0,1,1,,
Model assessment,Comparing across species and places,Comparing model outputs across different species or places,Soley-Guardia et al. (2024),Hazard 10,"Values given to scaling parameters are appropriate...........  the rescaling parameters are still equivalent among the entities involved (e.g. for ecologically similar species), rendering output values that are consistently incorrect yet comparable in absolute terms (Soley-Guardia et al. 2024).",Modulating assumptions (Low),"Suitability can only be interpreted as relative across the study area of a given analysis, and the values of the predictions of different models should not be directly compared across species or regions (Soley-Guardia et al. 2024).",Accuracy,"Suitability can only be interpreted as relative across the study area of a given analysis, The values of the predictions of different models should not be directly compared across species or regions",Low,Low,"Estimates of occupancy or abundance can be used to set the scaling parameters rather than relying on default values (Soley et al . 2024)., Make assumptions regarding scaling parameters for sets of species with similar natural histories (Soley et al . 2024)., Acknowledge modelers were unable to address this assumption.",1,1,0,0,,
Model assessment,Robustness,Overall impact of model assumptions,Araujo et al. (2019),Issue 4A,"Demonstrated lack of violation of, or robustness to, assumptions relevant for technique being used. Or consequencesfor inteppretation of results.",Modulating assumptions (Low),Most relevant assumptions (e.g. fundamental) and their potential effect on model rpedcitions (e.g. Very high risk in commision errors) are violated (e.g. Wiens et al. 2009).,"Accuracy, Precision, Overpredictions, Undepredictions",,High,High,,1,1,1,1,To what degree are you concerned about how well the modelling framework addresses important statistical assumptions?,"""What is the relative influence of sampling bias, sample size, and positional uncertainty on model results, and which factor is most important to address?"""
Model assessment,Outputs,"Realism, accuracy and generality",Araujo et al. (2019),Issue 4B,"Model is robust, performance metrics are meaningful, predictions are accurate and generalizable.",Fundamental assumptions (High),Overall assessment from the modelers perspective is that model is not quite robust and might mislead potenial usres,,,High,High,,1,1,1,1,"Identify the areas on the map where predictions are inaccurate., To what degree are you concerned about the spatial resolution of the predictor variables?","""Does a high model performance (e.g. accuracy) guarantee high reliability in the ecological relationships or transferability of predictions to different areas or future climates?"""
Model assessment,Model performance,Goodness of fit and uncertainty,Araujo et al. (2019),Issue 4C,"Measures of performance exhaustively summarize goodness of fit and discrimination. And, Patterns of uncertainty comprehensively characterized",Working assumptions (Moderate),"Uncertainty is a generalized in model predcitions, so modelers might advise use the model predictions with high caution",,,High,High,,1,1,1,0,"What other concerns do you have about model performance?, ""Identify areas on the map where uncertainty does not align with your understanding of data limitations, known habitat complexities, or other sources of uncertainty.""",
Model assessment,Interpretation,Setting an appropriate threshold,,,Transforming continuous habitat suitability predictions into a binary (presence/absence) map requires a threshold. The choice of this threshold directly influences the balance between omission and commission errors. (e.g. Benito et al. 2013),Working assumptions (Moderate),Binary maps are highly sensitive to threshold's values (e.g. Abdel-Moniem et al. 2025).,,,High,High,Compare multiple thresholding methods (see Abdel-Moniem et al. 2025; Guisan et al. (2025).,1,1,1,0,,